[
  {
    "sample_id": "100000",
    "source_dataset": "CM_dataset",
    "source_image_id": 1,
    "split": "demo",
    "tamper_status_l1": "manipulated",
    "tamper_type_l2": "copy_move",
    "task_mode": "classification_localization",
    "image_path": "images/100000/input.png",
    "original_path": "images/100000/original.png",
    "tampered_path": "images/100000/tampered.png",
    "mask_path": "images/100000/mask.png",
    "source_crop_path": "images/100000/source_crop.png",
    "target_crop_path": "images/100000/target_crop.png",
    "has_localization_gt": true,
    "question_ids": [
      1000000,
      1000001,
      1000002,
      1000003,
      1000004,
      1000005,
      1000006,
      1000007,
      1000008,
      1000009,
      1000010,
      1000011,
      1000012,
      1000013,
      1000014,
      1000015,
      1000016,
      1000017,
      1000018,
      1000019
    ],
    "caption": "",
    "caption_zh": null,
    "attributes": {
      "object_class": "Car",
      "source_region": "Right",
      "target_region": "Lower",
      "tampered_area_bucket": "One to Five Percent",
      "tampered_area_ratio": 0.01177978515625,
      "source_area_ratio": 0.00850677490234375,
      "relative_position": "Left side",
      "relative_size": "Bigger",
      "rotation_applied": true,
      "ai_used": null,
      "quality_tier": null
    },
    "raw_meta": {
      "origin_dataset": "droneDeploy",
      "info": {
        "Q1": "Yes",
        "Q2": "Car",
        "Q3": "No",
        "Q4": "Right",
        "Q5": "No",
        "Q6": "Lower",
        "Q7": "No",
        "Q8": "One to Five Percent",
        "Q8_tampered_size": 0.01177978515625,
        "Q8_source_size": 0.00850677490234375,
        "Q9": "No",
        "Q10": "Left side",
        "Q11": "No",
        "Q12": "Bigger",
        "Q13": "No",
        "Q14": "Yes"
      }
    }
  },
  {
    "sample_id": "100001",
    "source_dataset": "CM_dataset",
    "source_image_id": 2,
    "split": "demo",
    "tamper_status_l1": "manipulated",
    "tamper_type_l2": "copy_move",
    "task_mode": "classification_localization",
    "image_path": "images/100001/input.png",
    "original_path": "images/100001/original.png",
    "tampered_path": "images/100001/tampered.png",
    "mask_path": "images/100001/mask.png",
    "source_crop_path": "images/100001/source_crop.png",
    "target_crop_path": "images/100001/target_crop.png",
    "has_localization_gt": true,
    "question_ids": [
      1000020,
      1000021,
      1000022,
      1000023,
      1000024,
      1000025,
      1000026,
      1000027,
      1000028,
      1000029,
      1000030,
      1000031,
      1000032,
      1000033,
      1000034,
      1000035,
      1000036,
      1000037,
      1000038,
      1000039
    ],
    "caption": "",
    "caption_zh": null,
    "attributes": {
      "object_class": "Car",
      "source_region": "Upper",
      "target_region": "Lower",
      "tampered_area_bucket": "One to Five Percent",
      "tampered_area_ratio": 0.014133453369140625,
      "source_area_ratio": 0.0087890625,
      "relative_position": "Lower",
      "relative_size": "Bigger",
      "rotation_applied": false,
      "ai_used": null,
      "quality_tier": null
    },
    "raw_meta": {
      "origin_dataset": "droneDeploy",
      "info": {
        "Q1": "Yes",
        "Q2": "Car",
        "Q3": "No",
        "Q4": "Upper",
        "Q5": "No",
        "Q6": "Lower",
        "Q7": "No",
        "Q8": "One to Five Percent",
        "Q8_tampered_size": 0.014133453369140625,
        "Q8_source_size": 0.0087890625,
        "Q9": "No",
        "Q10": "Lower",
        "Q11": "No",
        "Q12": "Bigger",
        "Q13": "No",
        "Q14": "No"
      }
    }
  },
  {
    "sample_id": "100002",
    "source_dataset": "CM_dataset",
    "source_image_id": 3,
    "split": "demo",
    "tamper_status_l1": "manipulated",
    "tamper_type_l2": "copy_move",
    "task_mode": "classification_localization",
    "image_path": "images/100002/input.png",
    "original_path": "images/100002/original.png",
    "tampered_path": "images/100002/tampered.png",
    "mask_path": "images/100002/mask.png",
    "source_crop_path": "images/100002/source_crop.png",
    "target_crop_path": "images/100002/target_crop.png",
    "has_localization_gt": true,
    "question_ids": [
      1000040,
      1000041,
      1000042,
      1000043,
      1000044,
      1000045,
      1000046,
      1000047,
      1000048,
      1000049,
      1000050,
      1000051,
      1000052,
      1000053,
      1000054,
      1000055,
      1000056,
      1000057,
      1000058,
      1000059
    ],
    "caption": "",
    "caption_zh": null,
    "attributes": {
      "object_class": "Car",
      "source_region": "Upper",
      "target_region": "Left",
      "tampered_area_bucket": "One to Five Percent",
      "tampered_area_ratio": 0.0129241943359375,
      "source_area_ratio": 0.0087890625,
      "relative_position": "Left side",
      "relative_size": "Bigger",
      "rotation_applied": false,
      "ai_used": null,
      "quality_tier": null
    },
    "raw_meta": {
      "origin_dataset": "droneDeploy",
      "info": {
        "Q1": "Yes",
        "Q2": "Car",
        "Q3": "No",
        "Q4": "Upper",
        "Q5": "No",
        "Q6": "Left",
        "Q7": "No",
        "Q8": "One to Five Percent",
        "Q8_tampered_size": 0.0129241943359375,
        "Q8_source_size": 0.0087890625,
        "Q9": "No",
        "Q10": "Left side",
        "Q11": "No",
        "Q12": "Bigger",
        "Q13": "No",
        "Q14": "No"
      }
    }
  },
  {
    "sample_id": "100003",
    "source_dataset": "CM_dataset",
    "source_image_id": 4,
    "split": "demo",
    "tamper_status_l1": "manipulated",
    "tamper_type_l2": "copy_move",
    "task_mode": "classification_localization",
    "image_path": "images/100003/input.png",
    "original_path": "images/100003/original.png",
    "tampered_path": "images/100003/tampered.png",
    "mask_path": "images/100003/mask.png",
    "source_crop_path": "images/100003/source_crop.png",
    "target_crop_path": "images/100003/target_crop.png",
    "has_localization_gt": true,
    "question_ids": [
      1000060
    ],
    "caption": "",
    "caption_zh": null,
    "attributes": {
      "object_class": null,
      "source_region": null,
      "target_region": null,
      "tampered_area_bucket": null,
      "tampered_area_ratio": null,
      "source_area_ratio": null,
      "relative_position": null,
      "relative_size": null,
      "rotation_applied": null,
      "ai_used": null,
      "quality_tier": null
    },
    "raw_meta": {
      "origin_dataset": "droneDeploy",
      "info": {
        "Q1": "No"
      }
    }
  },
  {
    "sample_id": "100004",
    "source_dataset": "CM_dataset",
    "source_image_id": 5,
    "split": "demo",
    "tamper_status_l1": "manipulated",
    "tamper_type_l2": "copy_move",
    "task_mode": "classification_localization",
    "image_path": "images/100004/input.png",
    "original_path": "images/100004/original.png",
    "tampered_path": "images/100004/tampered.png",
    "mask_path": "images/100004/mask.png",
    "source_crop_path": "images/100004/source_crop.png",
    "target_crop_path": "images/100004/target_crop.png",
    "has_localization_gt": true,
    "question_ids": [
      1000061
    ],
    "caption": "",
    "caption_zh": null,
    "attributes": {
      "object_class": null,
      "source_region": null,
      "target_region": null,
      "tampered_area_bucket": null,
      "tampered_area_ratio": null,
      "source_area_ratio": null,
      "relative_position": null,
      "relative_size": null,
      "rotation_applied": null,
      "ai_used": null,
      "quality_tier": null
    },
    "raw_meta": {
      "origin_dataset": "droneDeploy",
      "info": {
        "Q1": "No"
      }
    }
  },
  {
    "sample_id": "200000",
    "source_dataset": "splice_dataset",
    "source_image_id": 0,
    "split": "demo",
    "tamper_status_l1": "manipulated",
    "tamper_type_l2": "splice",
    "task_mode": "classification_localization",
    "image_path": "images/200000/input.png",
    "original_path": "images/200000/original.png",
    "tampered_path": "images/200000/tampered.png",
    "mask_path": "images/200000/mask.png",
    "source_crop_path": null,
    "target_crop_path": null,
    "has_localization_gt": true,
    "question_ids": [
      2000000,
      2000001,
      2000002,
      2000003,
      2000004,
      2000005,
      2000006,
      2000007,
      2000008,
      2000009,
      2000010,
      2000011,
      2000012,
      2000013,
      2000014,
      2000015
    ],
    "caption": "",
    "caption_zh": null,
    "attributes": {
      "object_class": "Farmland",
      "source_region": "Upper",
      "target_region": null,
      "tampered_area_bucket": "Less than One Percent",
      "tampered_area_ratio": 0.0069809,
      "source_area_ratio": null,
      "relative_position": null,
      "relative_size": null,
      "rotation_applied": false,
      "ai_used": false,
      "quality_tier": "High"
    },
    "raw_meta": {
      "origin_dataset": "RS-CMQA-Splice",
      "info": {
        "Q1": "Yes",
        "Q2": "Farmland",
        "Q3": "Yes",
        "Q4": "Upper",
        "Q5": "Yes",
        "Q8": "Less than One Percent",
        "Q8_tampered_size": 0.0069809,
        "Q9": "Yes",
        "Q14": "No",
        "Q15": "Splice",
        "Q16": "No",
        "Q17": "High"
      },
      "file_name": "sp_000000.png"
    }
  },
  {
    "sample_id": "200001",
    "source_dataset": "splice_dataset",
    "source_image_id": 1,